{
  "binaryPath": "renameat2-helper",
  "contentDigest": {
    "algorithm": "sha256",
    "canonicalization": "recursive-lexicographic-object-key-sort-arrays-preserve-order-json-utf8-lf-v1",
    "domain": "shieldkit-labs/p2/gate-b/cohort-commit-helper-v1/descriptor/root",
    "frame": "utf8(domain)||0x00||canonical-json-utf8",
    "value": "ff29a4ba0e37f2ed0d520626f7b0b447355844010b1ff953b28cb7473f7fc420"
  },
  "helperId": "renameat2-noreplace-dir-commit-x86_64-linux-v1",
  "interface": {
    "argv": [
      "<executable>",
      "<old-basename>",
      "<new-basename>"
    ],
    "basenameRules": {
      "nonempty": true,
      "rejectDot": true,
      "rejectDotDot": true,
      "rejectSlash": true
    },
    "exitCodes": {
      "crossDevice": 18,
      "existing": 17,
      "otherErrno": 111,
      "success": 0,
      "usageOrName": 64
    },
    "requiredInheritedFds": [
      3,
      4,
      5
    ],
    "sourceValidation": {
      "comparisonFields": [
        "st_dev",
        "st_ino",
        "st_mode",
        "st_uid",
        "st_gid"
      ],
      "lookupFlags": "AT_SYMLINK_NOFOLLOW",
      "mismatchExit": 111,
      "postRenameCheck": true,
      "preRenameCheck": true,
      "raceBoundary": "cooperative-same-uid-namespace-name-check-not-atomic",
      "retainedSourceFd": 5,
      "sourceType": "directory"
    },
    "stdio": {
      "stderrByteLength": 0,
      "stdoutByteLength": 0
    }
  },
  "platform": "linux-x86_64",
  "schema": "shieldkit-labs/p2/gate-b/cohort-commit-helper-v1/descriptor/v1",
  "sourceBinding": {
    "byteLength": 5008,
    "path": "renameat2-helper.S",
    "rawSha256": "005b25ecbab20266e856242f19162a54abc27e9393ddde95313a3139a1cf308a"
  },
  "syscall": {
    "flags": {
      "RENAME_NOREPLACE": 1
    },
    "name": "renameat2",
    "newParentFd": 4,
    "number": 316,
    "oldParentFd": 3
  }
}
